{
  "$schema": "http://json-schema.org/draft-07/schema#",
  "$id": "https://nba-sim/config/schemas/resolve.schema.json",
  "title": "NBA Sim Resolve Contract (foundation 0.1.0)",
  "description": "Frozen homogeneous resolve contract for v0.1.0. All players share identical talent in this phase; outcome probabilities depend only on the base_rate for the situation, situation modifiers (pinned at neutral in v0.1.0), and one rng.next() draw. NO per-player talent field exists in this model. Sanity bands are targets the pace/possession regression (T21) will assert across seeds 1..256.",
  "type": "object",
  "required": ["foundation_version", "model", "base_rates", "sanity_bands", "ft_taxonomy_v0_1", "bonus_rule"],
  "additionalProperties": false,
  "properties": {
    "foundation_version": {
      "type": "string",
      "pattern": "^\\d+\\.\\d+\\.\\d+$",
      "description": "Semver stamp of the resolve contract. Must match config/foundation.json#foundation_version."
    },
    "model": {
      "type": "string",
      "pattern": "^[a-z][a-z0-9_]*$",
      "minLength": 1,
      "description": "Resolve model identifier. v0.1.0 ships `homogeneous_v0_1`; any change here is a major foundation_version bump."
    },
    "base_rates": {
      "type": "object",
      "required": [
        "pass_success",
        "handoff_success",
        "drive_success",
        "shot_make_2pt",
        "shot_make_3pt",
        "ft_make",
        "steal_attempt_success",
        "foul_on_drive_rate",
        "offensive_rebound_rate",
        "block_rate"
      ],
      "additionalProperties": false,
      "properties": {
        "pass_success": { "type": "number", "minimum": 0, "maximum": 1, "description": "P(an in-bounds pass reaches its receiver)." },
        "handoff_success": { "type": "number", "minimum": 0, "maximum": 1, "description": "P(a handoff completes cleanly to the receiver)." },
        "drive_success": { "type": "number", "minimum": 0, "maximum": 1, "description": "P(a drive reaches the rim without being stripped or stopped)." },
        "shot_make_2pt": { "type": "number", "minimum": 0, "maximum": 1, "description": "P(a released 2-point shot is made). Homogeneous baseline; no per-shooter talent in v0.1.0." },
        "shot_make_3pt": { "type": "number", "minimum": 0, "maximum": 1, "description": "P(a released 3-point shot is made). Homogeneous baseline." },
        "ft_make": { "type": "number", "minimum": 0, "maximum": 1, "description": "P(a free throw is made)." },
        "steal_attempt_success": { "type": "number", "minimum": 0, "maximum": 1, "description": "P(a steal attempt succeeds)." },
        "foul_on_drive_rate": { "type": "number", "minimum": 0, "maximum": 1, "description": "P(a drive draws a foul)." },
        "offensive_rebound_rate": { "type": "number", "minimum": 0, "maximum": 1, "description": "P(a missed shot rebounds offensive)." },
        "block_rate": { "type": "number", "minimum": 0, "maximum": 1, "description": "P(a contested shot is blocked)." }
      }
    },
    "shot_type_rates": {
      "type": "object",
      "required": [
        "catch_shoot_2pt",
        "catch_shoot_3pt",
        "pull_up_2pt",
        "pull_up_3pt",
        "post_2pt",
        "drive_finish_2pt",
        "other_2pt"
      ],
      "additionalProperties": false,
      "properties": {
        "catch_shoot_2pt": { "type": "number", "minimum": 0, "maximum": 1 },
        "catch_shoot_3pt": { "type": "number", "minimum": 0, "maximum": 1 },
        "pull_up_2pt": { "type": "number", "minimum": 0, "maximum": 1 },
        "pull_up_3pt": { "type": "number", "minimum": 0, "maximum": 1 },
        "post_2pt": { "type": "number", "minimum": 0, "maximum": 1 },
        "drive_finish_2pt": { "type": "number", "minimum": 0, "maximum": 1 },
        "other_2pt": { "type": "number", "minimum": 0, "maximum": 1 }
      },
      "description": "P1.2 shot-method taxonomy base rates."
    },
    "shot_type_block_bias": {
      "type": "object",
      "required": ["drive_finish", "post", "catch_shoot", "pull_up", "other"],
      "additionalProperties": false,
      "properties": {
        "drive_finish": { "type": "number", "minimum": 0, "maximum": 3 },
        "post": { "type": "number", "minimum": 0, "maximum": 3 },
        "catch_shoot": { "type": "number", "minimum": 0, "maximum": 3 },
        "pull_up": { "type": "number", "minimum": 0, "maximum": 3 },
        "other": { "type": "number", "minimum": 0, "maximum": 3 }
      },
      "description": "P1.3 block-rate multiplier per shot type."
    },
    "zone_modifiers_3pt": {
      "type": "object",
      "description": "Per-zone 3PT make-rate modifiers (NBA-empirical: corner ≈ +8% vs wings, flat elsewhere). Applied ONLY to 3-point attempts — the 2PT zone_modifiers table must not be reused for threes.",
      "additionalProperties": { "type": "number", "minimum": 0, "maximum": 1.5 }
    },
    "sanity_bands": {
      "type": "object",
      "required": [
        "fg_pct_min",
        "fg_pct_max",
        "tp_pct_min",
        "tp_pct_max",
        "score_per_team_min",
        "score_per_team_max",
        "oreb_pct_min",
        "oreb_pct_max"
      ],
      "additionalProperties": false,
      "properties": {
        "fg_pct_min": { "type": "number", "minimum": 0, "maximum": 1, "description": "Lower bound on aggregate field-goal percentage across the seeds 1..256 pace regression (T21)." },
        "fg_pct_max": { "type": "number", "minimum": 0, "maximum": 1, "description": "Upper bound on aggregate field-goal percentage." },
        "tp_pct_min": { "type": "number", "minimum": 0, "maximum": 1, "description": "Lower bound on aggregate 3-point percentage." },
        "tp_pct_max": { "type": "number", "minimum": 0, "maximum": 1, "description": "Upper bound on aggregate 3-point percentage." },
        "score_per_team_min": { "type": "number", "minimum": 0, "description": "Lower bound on mean per-team final score." },
        "score_per_team_max": { "type": "number", "minimum": 0, "description": "Upper bound on mean per-team final score." },
        "oreb_pct_min": { "type": "number", "minimum": 0, "maximum": 1, "description": "Lower bound on aggregate offensive-rebound percentage." },
        "oreb_pct_max": { "type": "number", "minimum": 0, "maximum": 1, "description": "Upper bound on aggregate offensive-rebound percentage." }
      },
      "$comment": "The `*_max >= *_min` invariants (fg_pct_max >= fg_pct_min, tp_pct_max >= tp_pct_min, score_per_team_max >= score_per_team_min, oreb_pct_max >= oreb_pct_min) are NOT expressed here because ajv-cli strict mode without the --data flag rejects the $data keyword. They are enforced by scripts/check-foundation.mjs (todo 9 linter) and by the visual jq audit `jq '.sanity_bands' config/resolve.json`."
    },
    "ft_taxonomy_v0_1": {
      "type": "object",
      "required": ["allowed", "forbidden"],
      "additionalProperties": false,
      "properties": {
        "allowed": {
          "type": "array",
          "minItems": 4,
          "maxItems": 4,
          "items": { "type": "string", "enum": ["2_shot", "3_shot", "and_one_1_shot", "bonus_2_shot"] },
          "$comment": "Phase-1 ONLY personal shooting fouls (decision Metis G3.3). minItems=maxItems=4 plus the items enum restricted to the 4 canonical values together force the array to be a 4-element permutation of those values; the three allOf branches below additionally pin presence of 3_shot, and_one_1_shot, and bonus_2_shot (the items enum already constrains every element, and `contains` for 2_shot would be redundant given length 4 + the other three branches)."
        },
        "forbidden": {
          "type": "array",
          "minItems": 4,
          "maxItems": 4,
          "items": { "type": "string", "enum": ["technical", "flagrant_1", "flagrant_2", "clear_path"] },
          "description": "FT types excluded from Phase-1: technical fouls, flagrant fouls of either degree, and clear-path fouls. Adding any of these is a major foundation_version bump."
        }
      },
      "allOf": [
        {
          "$comment": "Enforce all 4 allowed entries are present (order-independent).",
          "if": {
            "required": ["allowed"],
            "properties": { "allowed": { "type": "array" } }
          },
          "then": {
            "properties": {
              "allowed": { "type": "array", "contains": { "type": "string", "const": "3_shot" } }
            },
            "required": ["allowed"]
          }
        },
        {
          "if": {
            "required": ["allowed"],
            "properties": { "allowed": { "type": "array" } }
          },
          "then": {
            "properties": {
              "allowed": { "type": "array", "contains": { "type": "string", "const": "and_one_1_shot" } }
            },
            "required": ["allowed"]
          }
        },
        {
          "if": {
            "required": ["allowed"],
            "properties": { "allowed": { "type": "array" } }
          },
          "then": {
            "properties": {
              "allowed": { "type": "array", "contains": { "type": "string", "const": "bonus_2_shot" } }
            },
            "required": ["allowed"]
          }
        }
      ]
    },
    "bonus_rule": {
      "type": "object",
      "required": ["team_fouls_per_period_threshold", "description"],
      "additionalProperties": false,
      "properties": {
        "team_fouls_per_period_threshold": {
          "type": "integer",
          "minimum": 0,
          "description": "Team foul count within the current period at which the bonus is triggered. v0.1.0 pins 5 per NBA rule; subsequent non-shooting fouls award 2 FTs (the bonus_2_shot taxonomy entry)."
        },
        "description": {
          "type": "string",
          "minLength": 1,
          "description": "Human-readable summary of the bonus rule."
        }
      }
    }
  }
}
