{
  "foundation_version": "0.13.0",
  "model": "homogeneous_v0_1",
  "base_rates": {
    "pass_success": 0.94,
    "handoff_success": 0.97,
    "drive_success": 0.78,
    "shot_make_2pt": 0.565,
    "shot_make_3pt": 0.34,
    "ft_make": 0.77,
    "steal_attempt_success": 0.005,
    "foul_on_drive_rate": 0.1,
    "offensive_rebound_rate": 0.26,
    "block_rate": 0.05
  },
  "shot_type_rates": {
    "catch_shoot_2pt": 0.46,
    "catch_shoot_3pt": 0.33,
    "pull_up_2pt": 0.4,
    "pull_up_3pt": 0.27,
    "post_2pt": 0.45,
    "drive_finish_2pt": 0.6,
    "other_2pt": 0.42
  },
  "shot_type_block_bias": {
    "drive_finish": 1.4,
    "post": 1.2,
    "catch_shoot": 0.7,
    "pull_up": 0.8,
    "other": 1.0
  },
  "sanity_bands": {
    "fg_pct_min": 0.25,
    "fg_pct_max": 0.65,
    "tp_pct_min": 0.2,
    "tp_pct_max": 0.55,
    "score_per_team_min": 60,
    "score_per_team_max": 160,
    "oreb_pct_min": 0.1,
    "oreb_pct_max": 0.4
  },
  "zone_modifiers_3pt": {
    "wing_L": 1.0,
    "wing_R": 1.0,
    "corner_L": 1.08,
    "corner_R": 1.08,
    "slot_L": 1.0,
    "slot_R": 1.0,
    "frontcourt_center": 0.98,
    "backcourt": 0.05
  },
  "ft_taxonomy_v0_1": {
    "allowed": [
      "2_shot",
      "3_shot",
      "and_one_1_shot",
      "bonus_2_shot"
    ],
    "forbidden": [
      "technical",
      "flagrant_1",
      "flagrant_2",
      "clear_path"
    ]
  },
  "bonus_rule": {
    "team_fouls_per_period_threshold": 5,
    "description": "5th team foul in a period triggers bonus; all subsequent non-shooting fouls award 2 FTs"
  }
}